{
  "$schema": "https://json-schema.org/draft/2020-12/schema",
  "$id": "https://example.internal/ai-toolkit/collection.schema.json",
  "title": "AI toolkit collection",
  "description": "Manifest of a package: which topics (profile files) the viewer shows, in which order, and with which icon. Each topic is one profile that follows catalog.schema.json. Use cases (recipes) of each profile become the pages of the viewer. The viewer reads collection version 1.0 only.",
  "type": "object",
  "additionalProperties": false,
  "required": [
    "schemaVersion",
    "title",
    "topics"
  ],
  "properties": {
    "schemaVersion": {
      "const": "1.0"
    },
    "title": {
      "type": "string",
      "minLength": 1,
      "maxLength": 80
    },
    "description": {
      "type": "string",
      "maxLength": 400
    },
    "topics": {
      "type": "array",
      "minItems": 1,
      "maxItems": 40,
      "description": "Order matters: it is the order of the dashboard and of the Back and Next navigation.",
      "items": {
        "$ref": "#/$defs/topic"
      }
    }
  },
  "$defs": {
    "topic": {
      "type": "object",
      "additionalProperties": false,
      "required": [
        "id",
        "file"
      ],
      "properties": {
        "id": {
          "type": "string",
          "pattern": "^[a-z0-9]+(-[a-z0-9]+)*$",
          "minLength": 2,
          "maxLength": 48,
          "description": "Stable slug used in page links. Never change it after publishing."
        },
        "file": {
          "type": "string",
          "pattern": "^[A-Za-z0-9][A-Za-z0-9._-]*\\.json$",
          "maxLength": 80,
          "description": "File name of the profile next to the collection. No paths."
        },
        "icon": {
          "type": "string",
          "pattern": "^[a-z0-9-]+$",
          "description": "Icon name from the viewer's icon set, shown on the dashboard."
        }
      }
    }
  },
  "x-crossReferenceRules": [
    "topic ids are unique",
    "topic files are unique",
    "every listed file exists next to the collection and validates against catalog.schema.json (checked by the validate script and the viewer)"
  ]
}
