{
  "schemaVersion": "1.0",
  "title": "AI and automation toolkit",
  "description": "Demo package: two topics, each with its use cases. Facts were checked on 2026-10-19; texts and ratings are proposals.",
  "topics": [
    { "id": "automation-agents-data", "file": "profile-automation-agents-data.json", "icon": "workflow" },
    { "id": "browser-automation", "file": "catalog.json", "icon": "globe" }
  ]
}
